{"$schema":"https://json-schema.org/draft/2020-12/schema","$id":"case.schema.json","type":"object","additionalProperties":false,"required":["schemaVersion","id","familyId","title","version","mode","brief","prompt","expectations"],"properties":{"schemaVersion":{"const":1},"id":{"type":"string","pattern":"^[a-z0-9][a-z0-9.-]+$"},"familyId":{"type":"string"},"title":{"type":"string","minLength":1},"version":{"type":"string","minLength":1},"mode":{"enum":["GREENFIELD","EVOLUTION","REVIEW"]},"brief":{"type":"string"},"prompt":{"type":"string"},"expectations":{"type":"string"},"fixture":{"type":"string"}}}
